"Source Title";"Scopus Source ID";"MCQ";"p_issn";"e_issn";"Top 10%";"10% - 35%";"35% - 60%";"60% - 80%";"Bottom 20%"
"AAPP Atti della Accademia Peloritana dei Pericolanti, Classe di Scienze Fisiche, Matematiche e Naturali";21100199540;0,136363636363636;"03650359";"18251242";"NO Top 10%";"NO 10% - 35%";"NO 35% - 60%";5;0
"AKCE International Journal of Graphs and Combinatorics";19900193225;0,117647058823529;"09728600";0;"NO Top 10%";"NO 10% - 35%";"NO 35% - 60%";7;0
"Abhandlungen aus dem Mathematischen Seminar der Universitat Hamburg";27488;0,526315789473684;"00255858";"18658784";"NO Top 10%";7;1;0;"NO Bottom 20%"
"Acta Arithmetica";24100;0,522330097087379;"00651036";"17306264";"NO Top 10%";9;1;0;"NO Bottom 20%"
"Acta Mathematica";24527;3,98461538461538;"00015962";"18712509";1;0;"NO 35% - 60%";"NO 60% - 80%";"NO Bottom 20%"
"Acta Mathematica Hungarica";24529;0,462121212121212;"02365294";"15882632";"NO Top 10%";"NO 10% - 35%";1;0;"NO Bottom 20%"
"Acta Mathematica Scientia";24531;0,480499219968799;"02529602";"15729087";"NO Top 10%";"NO 10% - 35%";1;0;"NO Bottom 20%"
"Acta Mathematica Sinica, Chinese Series";21100235603;0,12183908045977;"05831431";0;"NO Top 10%";"NO 10% - 35%";"NO 35% - 60%";6;0
"Acta Mathematica Sinica, English Series";24533;0,40922619047619;"14398516";"14397617";"NO Top 10%";"NO 10% - 35%";2;0;"NO Bottom 20%"
"Acta Mathematica Universitatis Comenianae";76019;0,129496402877698;"08629544";"13360310";"NO Top 10%";"NO 10% - 35%";"NO 35% - 60%";5;0
"Acta Mathematica Vietnamica";21100199843;0,384615384615385;"02514184";0;"NO Top 10%";"NO 10% - 35%";3;0;"NO Bottom 20%"
"Acta et Commentationes Universitatis Tartuensis de Mathematica";21100329307;0,0526315789473684;"14062283";"22284699";"NO Top 10%";"NO 10% - 35%";"NO 35% - 60%";"NO 60% - 80%";0
"Advanced Studies in Contemporary Mathematics (Kyungshang)";10600153363;0,285714285714286;"12293067";"25087908";"NO Top 10%";"NO 10% - 35%";"NO 35% - 60%";1;0
"Advances in Applied Mathematics";24556;0,778481012658228;"01968858";"10902074";6;1;0;"NO 60% - 80%";"NO Bottom 20%"
"Advances in Group Theory and Applications";21100915265;0,117647058823529;"24991287";0;"NO Top 10%";"NO 10% - 35%";"NO 35% - 60%";7;0
"Advances in Mathematics";24570;1,65162644281217;"00018708";"10902082";1;0;"NO 35% - 60%";"NO 60% - 80%";"NO Bottom 20%"
"Advances in Mathematics of Communications";18800156711;0,6125;"19305346";"19305338";"NO Top 10%";2;0;"NO 60% - 80%";"NO Bottom 20%"
"Advances in Pure and Applied Mathematics";21100199335;0,232142857142857;"18671152";"18696090";"NO Top 10%";"NO 10% - 35%";"NO 35% - 60%";2;0
"Aequationes Mathematicae";24573;0,455263157894737;"00019054";"14208903";"NO Top 10%";"NO 10% - 35%";1;0;"NO Bottom 20%"
"Afrika Matematika";21100228566;0,142300194931774;"10129405";"21907668";"NO Top 10%";"NO 10% - 35%";"NO 35% - 60%";4;0
"Algebra Colloquium";24616;0,35472972972973;"10053867";0;"NO Top 10%";"NO 10% - 35%";4;0;"NO Bottom 20%"
"Algebra Universalis";24618;0,436065573770492;"00025240";"14208911";"NO Top 10%";"NO 10% - 35%";2;0;"NO Bottom 20%"
"Algebra and Discrete Mathematics";21100206241;0,179824561403509;"17263255";0;"NO Top 10%";"NO 10% - 35%";"NO 35% - 60%";3;0
"Algebra and Number Theory";19700175257;1,21511627906977;"19370652";0;2;0;"NO 35% - 60%";"NO 60% - 80%";"NO Bottom 20%"
"Algebras and Representation Theory";24620;0,627968337730871;"1386923X";"15729079";"NO Top 10%";2;0;"NO 60% - 80%";"NO Bottom 20%"
"American Journal of Mathematics";24654;1,68831168831169;"00029327";"10806377";1;0;"NO 35% - 60%";"NO 60% - 80%";"NO Bottom 20%"
"American Mathematical Monthly";24656;0,233024691358025;"00029890";"19300972";"NO Top 10%";"NO 10% - 35%";"NO 35% - 60%";1;0
"Analele Stiintifice ale Universitatii Al I Cuza din Iasi - Matematica";19700175303;0,100401606425703;"12218421";0;"NO Top 10%";"NO 10% - 35%";"NO 35% - 60%";"NO 60% - 80%";0
"Analysis Mathematica";24691;0,326388888888889;"01333852";"1588273X";"NO Top 10%";"NO 10% - 35%";10;1;0
"Annales Polonici Mathematici";20900195109;0,397260273972603;"00662216";"17306272";"NO Top 10%";"NO 10% - 35%";2;0;"NO Bottom 20%"
"Annales Scientifiques de l'Ecole Normale Superieure";25959;2,22543352601156;"00129593";0;1;0;"NO 35% - 60%";"NO 60% - 80%";"NO Bottom 20%"
"Annales de l'Institut Fourier";23199;0,969849246231156;"03730956";0;2;0;"NO 35% - 60%";"NO 60% - 80%";"NO Bottom 20%"
"Annali dell'Universita di Ferrara";7000153270;0,355371900826446;"04303202";"18271510";"NO Top 10%";"NO 10% - 35%";4;0;"NO Bottom 20%"
"Annali della Scuola normale superiore di Pisa - Classe di scienze";4700151702;1,06614785992218;"0391173X";"20362145";2;0;"NO 35% - 60%";"NO 60% - 80%";"NO Bottom 20%"
"Annali di Matematica Pura ed Applicata";6200180175;1,0081466395112;"03733114";"16181891";2;0;"NO 35% - 60%";"NO 60% - 80%";"NO Bottom 20%"
"Annals of Mathematics";24721;5,25358851674641;"0003486X";"19398980";1;0;"NO 35% - 60%";"NO 60% - 80%";"NO Bottom 20%"
"Annals of the Academy of Romanian Scientists: Series on Mathematics and its Applications";20300195018;0,105882352941176;"20665997";"20666594";"NO Top 10%";"NO 10% - 35%";"NO 35% - 60%";27;0
"Applicable Algebra in Engineering, Communications and Computing";28048;0,489510489510489;"09381279";"14320622";"NO Top 10%";"NO 10% - 35%";1;0;"NO Bottom 20%"
"Applied Categorical Structures";28049;0,526748971193416;"09272852";"15729095";"NO Top 10%";7;1;0;"NO Bottom 20%"
"Applied Mathematics and Computation";25170;0,605943415428455;"00963003";"18735649";"NO Top 10%";2;0;"NO 60% - 80%";"NO Bottom 20%"
"Archiv der Mathematik";25206;0,514331210191083;"0003889X";"14208938";"NO Top 10%";13;1;0;"NO Bottom 20%"
"Archivum Mathematicum";25210;0,142857142857143;"00448753";"12125059";"NO Top 10%";"NO 10% - 35%";"NO 35% - 60%";4;0
"Arkiv for Matematik";25213;0,884615384615385;"00042080";"18712487";3;0;"NO 35% - 60%";"NO 60% - 80%";"NO Bottom 20%"
"Ars Combinatoria";25215;0,141891891891892;"03817032";0;"NO Top 10%";"NO 10% - 35%";"NO 35% - 60%";4;0
"Asian-European Journal of Mathematics";21100198431;0,15839243498818;"17935571";"17937183";"NO Top 10%";"NO 10% - 35%";"NO 35% - 60%";3;0
"Asymptotic Analysis";25239;0,738515901060071;"09217134";"18758576";"NO Top 10%";1;0;"NO 60% - 80%";"NO Bottom 20%"
"Atti della Accademia Nazionale dei Lincei, Classe di Scienze Fisiche, Matematiche e Naturali, Rendiconti Lincei Matematica E Applicazioni";24096;1,03592814371258;"11206330";"17200768";2;0;"NO 35% - 60%";"NO 60% - 80%";"NO Bottom 20%"
"Australasian Journal of Combinatorics";17700155817;0,338785046728972;"10344942";"22023518";"NO Top 10%";"NO 10% - 35%";5;1;0
"Azerbaijan Journal of Mathematics";21100285045;0,231481481481481;"22186816";"22219501";"NO Top 10%";"NO 10% - 35%";"NO 35% - 60%";2;0
"Beitrage zur Algebra und Geometrie";25262;0,280155642023346;"01384821";"21910383";"NO Top 10%";"NO 10% - 35%";"NO 35% - 60%";1;0
"Boletim da Sociedade Paranaense de Matematica";19700201433;0,144578313253012;"00378712";"21751188";"NO Top 10%";"NO 10% - 35%";"NO 35% - 60%";4;0
"Boletin de la Sociedad Matematica Mexicana";65749;0,212643678160919;"00378615";"1405213X";"NO Top 10%";"NO 10% - 35%";"NO 35% - 60%";2;0
"Bolletino dell Unione Matematica Italiana";11300153723;0,5;"19726724";"21982759";"NO Top 10%";"NO 10% - 35%";1;0;"NO Bottom 20%"
"Buletinul Academiei de Stiinte a Republicii Moldova. Matematica";19900192610;0,0638297872340425;"10247696";0;"NO Top 10%";"NO 10% - 35%";"NO 35% - 60%";"NO 60% - 80%";0
"Bulletin Mathematique de la Societe des Sciences Mathematiques de Roumanie";19700175301;0,209424083769633;"12203874";0;"NO Top 10%";"NO 10% - 35%";"NO 35% - 60%";2;0
"Bulletin de la Societe Mathematique de France";26886;0,71551724137931;"00379484";0;"NO Top 10%";1;0;"NO 60% - 80%";"NO Bottom 20%"
"Bulletin des Sciences Mathematiques";25286;0,693877551020408;"00074497";0;"NO Top 10%";1;0;"NO 60% - 80%";"NO Bottom 20%"
"Bulletin of the Australian Mathematical Society";25244;0,361153262518968;"00049727";"17551633";"NO Top 10%";"NO 10% - 35%";3;0;"NO Bottom 20%"
"Bulletin of the Belgian Mathematical Society - Simon Stevin";25266;0,327205882352941;"13701444";0;"NO Top 10%";"NO 10% - 35%";7;1;0
"Bulletin of the Brazilian Mathematical Society";79372;0,410041841004184;"16787544";"16787714";"NO Top 10%";"NO 10% - 35%";2;0;"NO Bottom 20%"
"Bulletin of the Iranian Mathematical Society";15900154754;0,17027417027417;"10186301";"1017060X";"NO Top 10%";"NO 10% - 35%";"NO 35% - 60%";3;0
"Bulletin of the Korean Mathematical Society";4000148822;0,258411843876178;"10158634";"22343016";"NO Top 10%";"NO 10% - 35%";"NO 35% - 60%";1;0
"Bulletin of the Kyushu Institute of Technology - Pure and Applied Mathematics";21100236827;0,3;"13438670";0;"NO Top 10%";"NO 10% - 35%";"NO 35% - 60%";1;0
"Bulletin of the London Mathematical Society";24481;0,823300970873786;"00246093";"14692120";4;0;"NO 35% - 60%";"NO 60% - 80%";"NO Bottom 20%"
"Bulletin of the Malaysian Mathematical Sciences Society";17600155053;0,422680412371134;"01266705";"21804206";"NO Top 10%";"NO 10% - 35%";2;0;"NO Bottom 20%"
"Bulletin of the Transilvania University of Brasov, Series III: Mathematics, Informatics, Physics";20500195045;0,0201342281879194;"20652151";"2065216X";"NO Top 10%";"NO 10% - 35%";"NO 35% - 60%";"NO 60% - 80%";0
"Canadian Journal of Mathematics";101474;0,9;"0008414X";"14964279";3;0;"NO 35% - 60%";"NO 60% - 80%";"NO Bottom 20%"
"Canadian Mathematical Bulletin";25329;0,545012165450122;"00084395";"14964287";"NO Top 10%";4;1;0;"NO Bottom 20%"
"Carpathian Journal of Mathematics";19700175588;0,328947368421053;"15842851";"18434401";"NO Top 10%";"NO 10% - 35%";7;1;0
"Chaos, Solitons and Fractals";25347;0,232662192393736;"09600779";0;"NO Top 10%";"NO 10% - 35%";"NO 35% - 60%";1;0
"Collectanea Mathematica";5600157643;0,676258992805755;"00100757";"20384815";"NO Top 10%";1;0;"NO 60% - 80%";"NO Bottom 20%"
"Colloquium Mathematicum";21100199542;0,400932400932401;"00101354";"17306302";"NO Top 10%";"NO 10% - 35%";2;0;"NO Bottom 20%"
"Commentarii Mathematici Helvetici";25787;1,19858156028369;"00102571";"14208946";2;0;"NO 35% - 60%";"NO 60% - 80%";"NO Bottom 20%"
"Commentationes Mathematicae Universitatis Carolinae";20000195079;0,222748815165877;"00102628";"12137243";"NO Top 10%";"NO 10% - 35%";"NO 35% - 60%";2;0
"Communications in Algebra";25800;0,454309449636552;"00927872";"15324125";"NO Top 10%";"NO 10% - 35%";1;0;"NO Bottom 20%"
"Communications in Mathematical Physics";27437;1,62482065997131;"00103616";"14320916";1;0;"NO 35% - 60%";"NO 60% - 80%";"NO Bottom 20%"
"Compositio Mathematica";25826;1,58968058968059;"0010437X";"15705846";1;0;"NO 35% - 60%";"NO 60% - 80%";"NO Bottom 20%"
"Comptes Rendus Mathematique";24095;0,636363636363636;"1631073X";"17783569";"NO Top 10%";2;0;"NO 60% - 80%";"NO Bottom 20%"
"Czechoslovak Mathematical Journal";25840;0,33756345177665;"00114642";"15729141";"NO Top 10%";"NO 10% - 35%";5;1;0
"Demonstratio Mathematica";21100836176;0,24;"04201213";"23914661";"NO Top 10%";"NO 10% - 35%";"NO 35% - 60%";1;0
"Discrete Mathematics";25892;0,650723725613593;"0012365X";0;"NO Top 10%";2;0;"NO 60% - 80%";"NO Bottom 20%"
"Dissertationes Mathematicae";21100199568;0,902439024390244;"00123862";"17306310";3;0;"NO 35% - 60%";"NO 60% - 80%";"NO Bottom 20%"
"Documenta Mathematica";145273;0,962962962962963;"14310635";"14310643";2;0;"NO 35% - 60%";"NO 60% - 80%";"NO Bottom 20%"
"Doklady Mathematics";25924;0,297082228116711;"10645624";"15318362";"NO Top 10%";"NO 10% - 35%";"NO 35% - 60%";1;0
"Duke Mathematical Journal";25936;2,76119402985075;"00127094";"15477398";1;0;"NO 35% - 60%";"NO 60% - 80%";"NO Bottom 20%"
"Electronic Journal of Combinatorics";26389;0,622493461203139;"10778926";"10971440";"NO Top 10%";2;0;"NO 60% - 80%";"NO Bottom 20%"
"Electronic Journal of Linear Algebra";26394;0,429967426710098;"10813810";"10813810";"NO Top 10%";"NO 10% - 35%";2;0;"NO Bottom 20%"
"Eurasian Mathematical Journal";21100336501;0,168831168831169;"20779879";0;"NO Top 10%";"NO 10% - 35%";"NO 35% - 60%";3;0
"European Journal of Combinatorics";26445;0,756462585034014;"01956698";"10959971";"NO Top 10%";1;0;"NO 60% - 80%";"NO Bottom 20%"
"Experimental Mathematics";26448;0,580487804878049;"10586458";"1944950X";"NO Top 10%";3;0;"NO 60% - 80%";"NO Bottom 20%"
"Expositiones Mathematicae";26451;0,6875;"07230869";0;"NO Top 10%";1;0;"NO 60% - 80%";"NO Bottom 20%"
"Fibonacci Quarterly";26467;0,34412955465587;"00150517";0;"NO Top 10%";"NO 10% - 35%";4;0;"NO Bottom 20%"
"Filomat";19900192450;0,301587301587301;"03545180";0;"NO Top 10%";"NO 10% - 35%";"NO 35% - 60%";1;0
"Finite Fields and Their Applications";26480;0,947058823529412;"10715797";"10902465";2;0;"NO 35% - 60%";"NO 60% - 80%";"NO Bottom 20%"
"Forum Mathematicum";26488;0,740740740740741;"09337741";"14355337";"NO Top 10%";1;0;"NO 60% - 80%";"NO Bottom 20%"
"Functiones et Approximatio, Commentarii Mathematici";21100284506;0,343915343915344;"02086573";"20809433";"NO Top 10%";"NO 10% - 35%";5;1;0
"Fundamenta Mathematicae";26527;0,637323943661972;"00162736";"17306329";"NO Top 10%";2;0;"NO 60% - 80%";"NO Bottom 20%"
"Geometriae Dedicata";26578;0,61569416498994;"00465755";"15729168";"NO Top 10%";2;0;"NO 60% - 80%";"NO Bottom 20%"
"Georgian Mathematical Journal";6100152706;0,237226277372263;"15729176";"1072947X";"NO Top 10%";"NO 10% - 35%";"NO 35% - 60%";1;0
"Glasgow Mathematical Journal";26585;0,502164502164502;"00170895";"1469509X";"NO Top 10%";"NO 10% - 35%";1;0;"NO Bottom 20%"
"Glasnik Matematicki";4700152292;0,347222222222222;"0017095X";0;"NO Top 10%";"NO 10% - 35%";4;0;"NO Bottom 20%"
"Graphs and Combinatorics";28476;0,416781292984869;"09110119";"14355914";"NO Top 10%";"NO 10% - 35%";2;0;"NO Bottom 20%"
"Hacettepe Journal of Mathematics and Statistics";19400157155;0,164075993091537;"13035010";"2651477X";"NO Top 10%";"NO 10% - 35%";"NO 35% - 60%";3;0
"Hiroshima Mathematical Journal";19300156905;0,276595744680851;"00182079";0;"NO Top 10%";"NO 10% - 35%";"NO 35% - 60%";1;0
"Hokkaido Mathematical Journal";19900193823;0,28448275862069;"03854035";0;"NO Top 10%";"NO 10% - 35%";"NO 35% - 60%";1;0
"Homology, Homotopy and Applications";145269;0,575916230366492;"15320073";"15320081";"NO Top 10%";3;0;"NO 60% - 80%";"NO Bottom 20%"
"Houston Journal of Mathematics";23131;0,363636363636364;"03621588";0;"NO Top 10%";"NO 10% - 35%";3;0;"NO Bottom 20%"
"Illinois Journal of Mathematics";23172;0,581632653061224;"00192082";0;"NO Top 10%";3;0;"NO 60% - 80%";"NO Bottom 20%"
"Indagationes Mathematicae";23176;0,575903614457831;"00193577";0;"NO Top 10%";3;0;"NO 60% - 80%";"NO Bottom 20%"
"Indian Journal of Mathematics";21100235837;0,125;"00195324";0;"NO Top 10%";"NO 10% - 35%";"NO 35% - 60%";5;0
"Indiana University Mathematics Journal";23194;1,36516853932584;"00222518";0;1;0;"NO 35% - 60%";"NO 60% - 80%";"NO Bottom 20%"
"Integral Equations and Operator Theory";23228;0,798969072164948;"0378620X";"14208989";5;1;0;"NO 60% - 80%";"NO Bottom 20%"
"Integral Transforms and Special Functions";23229;0,492268041237113;"10652469";"14768291";"NO Top 10%";"NO 10% - 35%";1;0;"NO Bottom 20%"
"International Journal of Algebra and Computation";23230;0,538461538461538;"02181967";0;"NO Top 10%";6;1;0;"NO Bottom 20%"
"International Journal of Group Theory";21100329547;0,201754385964912;"22517650";"22517669";"NO Top 10%";"NO 10% - 35%";"NO 35% - 60%";2;0
"International Journal of Mathematics";23244;0,620355411954766;"0129167X";0;"NO Top 10%";2;0;"NO 60% - 80%";"NO Bottom 20%"
"International Journal of Number Theory";11700154720;0,519230769230769;"17930421";0;"NO Top 10%";10;1;0;"NO Bottom 20%"
"International Mathematics Research Notices";23261;1,19302152932443;"10737928";"16870247";2;0;"NO 35% - 60%";"NO 60% - 80%";"NO Bottom 20%"
"Inventiones Mathematicae";23262;3,58953168044077;"00209910";"14321297";1;0;"NO 35% - 60%";"NO 60% - 80%";"NO Bottom 20%"
"Iranian Journal of Mathematical Sciences and Informatics";21100198728;0,116071428571429;"17354463";"20089473";"NO Top 10%";"NO 10% - 35%";"NO 35% - 60%";9;0
"Israel Journal of Mathematics";23270;0,830073349633252;"00212172";"15658511";4;0;"NO 35% - 60%";"NO 60% - 80%";"NO Bottom 20%"
"Italian Journal of Pure and Applied Mathematics";19900192426;0,075187969924812;"11268042";"22390227";"NO Top 10%";"NO 10% - 35%";"NO 35% - 60%";"NO 60% - 80%";0
"Izvestiya Mathematics";23294;0,587755102040816;"10645632";"14684810";"NO Top 10%";2;0;"NO 60% - 80%";"NO Bottom 20%"
"Japanese Journal of Mathematics";4700152846;1,29032258064516;"02892316";"18613624";1;0;"NO 35% - 60%";"NO 60% - 80%";"NO Bottom 20%"
"Journal de Theorie des Nombres de Bordeaux";19900192727;0,327014218009479;"12467405";"21188572";"NO Top 10%";"NO 10% - 35%";8;1;0
"Journal fur die Reine und Angewandte Mathematik";23796;1,53012048192771;"00754102";"14355345";1;0;"NO 35% - 60%";"NO 60% - 80%";"NO Bottom 20%"
"Journal of Algebra";23814;0,74296205630355;"00218693";"1090266X";"NO Top 10%";1;0;"NO 60% - 80%";"NO Bottom 20%"
"Journal of Algebra and its Applications";11800154589;0,482625482625483;"02194988";0;"NO Top 10%";"NO 10% - 35%";1;0;"NO Bottom 20%"
"Journal of Algebraic Combinatorics";23816;0,771883289124668;"09259899";"15729192";8;1;0;"NO 60% - 80%";"NO Bottom 20%"
"Journal of Applied Mathematics";144917;0,11006711409396;"1110757X";"16870042";"NO Top 10%";"NO 10% - 35%";"NO 35% - 60%";11;0
"Journal of Combinatorial Mathematics and Combinatorial Computing";19700186819;0,125;"08353026";0;"NO Top 10%";"NO 10% - 35%";"NO 35% - 60%";5;0
"Journal of Combinatorial Theory - Series A";40107;1,12962962962963;"00973165";"10960899";2;0;"NO 35% - 60%";"NO 60% - 80%";"NO Bottom 20%"
"Journal of Combinatorial Theory. Series B";23844;1,28228228228228;"00958956";"10960902";2;0;"NO 35% - 60%";"NO 60% - 80%";"NO Bottom 20%"
"Journal of Commutative Algebra";21100228023;0,401408450704225;"19390807";"19392346";"NO Top 10%";"NO 10% - 35%";2;0;"NO Bottom 20%"
"Journal of Difference Equations and Applications";23872;0,504780114722753;"10236198";"15635120";"NO Top 10%";21;1;0;"NO Bottom 20%"
"Journal of Formalized Reasoning";21100262198;0,545454545454545;"19725787";"19725787";"NO Top 10%";4;1;0;"NO Bottom 20%"
"Journal of Group Theory";23910;0,539007092198582;"14335883";"14354446";"NO Top 10%";5;1;0;"NO Bottom 20%"
"Journal of Integer Sequences";23914;0,329081632653061;"15307638";"15307638";"NO Top 10%";"NO 10% - 35%";6;1;0
"Journal of Knot Theory and its Ramifications";23921;0,42015503875969;"02182165";0;"NO Top 10%";"NO 10% - 35%";2;0;"NO Bottom 20%"
"Journal of Lie Theory";23933;0,397058823529412;"09495932";0;"NO Top 10%";"NO 10% - 35%";2;0;"NO Bottom 20%"
"Journal of Mathematical Analysis and Applications";23935;0,940980187695516;"0022247X";"10960813";3;0;"NO 35% - 60%";"NO 60% - 80%";"NO Bottom 20%"
"Journal of Mathematical Physics";28544;0,614452798663325;"00222488";"10897658";"NO Top 10%";2;0;"NO 60% - 80%";"NO Bottom 20%"
"Journal of Mathematical Sciences (Japan)";21100203913;0,586666666666667;"13405705";0;"NO Top 10%";2;0;"NO 60% - 80%";"NO Bottom 20%"
"Journal of Noncommutative Geometry";17800156749;0,761904761904762;"16616952";"16616960";53;1;0;"NO 60% - 80%";"NO Bottom 20%"
"Journal of Number Theory";23961;0,631313131313131;"0022314X";"10961658";"NO Top 10%";2;0;"NO 60% - 80%";"NO Bottom 20%"
"Journal of Operator Theory";23965;0,663793103448276;"03794024";"18417744";"NO Top 10%";1;0;"NO 60% - 80%";"NO Bottom 20%"
"Journal of Pure and Applied Algebra";23968;0,745714285714286;"00224049";0;"NO Top 10%";1;0;"NO 60% - 80%";"NO Bottom 20%"
"Journal of Symbolic Computation";28503;0,582172701949861;"07477171";"1095855X";"NO Top 10%";2;0;"NO 60% - 80%";"NO Bottom 20%"
"Journal of the American Mathematical Society";24668;5,22480620155039;"08940347";"10886834";1;0;"NO 35% - 60%";"NO 60% - 80%";"NO Bottom 20%"
"Journal of the Australian Mathematical Society";25255;0,643776824034335;"14467887";"14468107";"NO Top 10%";2;0;"NO 60% - 80%";"NO Bottom 20%"
"Journal of the European Mathematical Society";26447;2,28712871287129;"14359855";"14359863";1;0;"NO 35% - 60%";"NO 60% - 80%";"NO Bottom 20%"
"Journal of the Indian Mathematical Society";21100259506;0,065359477124183;"00195839";"24556475";"NO Top 10%";"NO 10% - 35%";"NO 35% - 60%";"NO 60% - 80%";0
"Journal of the Institute of Mathematics of Jussieu";5800228226;1,08461538461538;"14747480";"14753030";2;0;"NO 35% - 60%";"NO 60% - 80%";"NO Bottom 20%"
"Journal of the Korean Mathematical Society";145254;0,413875598086124;"03049914";"22343008";"NO Top 10%";"NO 10% - 35%";2;0;"NO Bottom 20%"
"Journal of the London Mathematical Society";24483;1,21641791044776;"00246107";"14697750";2;0;"NO 35% - 60%";"NO 60% - 80%";"NO Bottom 20%"
"Journal of the Mathematical Society of Japan";25058;0,801857585139319;"00255645";"18811167";5;1;0;"NO 60% - 80%";"NO Bottom 20%"
"Journal of the Ramanujan Mathematical Society";21100297612;0,271186440677966;"09701249";"23203110";"NO Top 10%";"NO 10% - 35%";"NO 35% - 60%";1;0
"Kodai Mathematical Journal";19700176234;0,369458128078818;"03865991";"18815472";"NO Top 10%";"NO 10% - 35%";3;0;"NO Bottom 20%"
"Kragujevac Journal of Mathematics";21100199782;0,211678832116788;"14509628";"24063045";"NO Top 10%";"NO 10% - 35%";"NO 35% - 60%";2;0
"Kyoto Journal of Mathematics";24453;0,66875;"21562261";"21543321";"NO Top 10%";1;0;"NO 60% - 80%";"NO Bottom 20%"
"Kyushu Journal of Mathematics";7500153108;0,364406779661017;"13406116";0;"NO Top 10%";"NO 10% - 35%";3;0;"NO Bottom 20%"
"Linear Algebra and Its Applications";24475;0,76668101592768;"00243795";0;10;1;0;"NO 60% - 80%";"NO Bottom 20%"
"Linear and Multilinear Algebra";24476;0,742562929061785;"03081087";"15635139";"NO Top 10%";1;0;"NO 60% - 80%";"NO Bottom 20%"
"Lithuanian Mathematical Journal";24478;0,201030927835051;"03631672";"15738825";"NO Top 10%";"NO 10% - 35%";"NO 35% - 60%";2;0
"Lobachevskii Journal of Mathematics";24479;0,154135338345865;"19950802";"18189962";"NO Top 10%";"NO 10% - 35%";"NO 35% - 60%";3;0
"Manuscripta Mathematica";24490;0,574358974358974;"00252611";"14321785";"NO Top 10%";3;0;"NO 60% - 80%";"NO Bottom 20%"
"Matematica, Cultura e Societa";21100904887;0;"2499751X";0;"NO Top 10%";"NO 10% - 35%";"NO 35% - 60%";"NO 60% - 80%";0
"Matematiche";21100846307;0,189024390243902;"03733505";"20375298";"NO Top 10%";"NO 10% - 35%";"NO 35% - 60%";2;0
"Matematicki Vesnik";145255;0,167664670658683;"00255165";"24060682";"NO Top 10%";"NO 10% - 35%";"NO 35% - 60%";3;0
"Mathematica";18300156725;0,04;"12229016";"2601744X";"NO Top 10%";"NO 10% - 35%";"NO 35% - 60%";"NO 60% - 80%";0
"Mathematica Bohemica";19900192004;0,21978021978022;"08627959";"24647136";"NO Top 10%";"NO 10% - 35%";"NO 35% - 60%";2;0
"Mathematica Scandinavica";24552;0,545977011494253;"00255521";0;"NO Top 10%";4;1;0;"NO Bottom 20%"
"Mathematica Slovaca";11900154311;0,267326732673267;"01399918";"13372211";"NO Top 10%";"NO 10% - 35%";"NO 35% - 60%";1;0
"Mathematical Communications";19500157817;0,258333333333333;"13310623";0;"NO Top 10%";"NO 10% - 35%";"NO 35% - 60%";1;0
"Mathematical Modelling and Analysis";100147323;0,304526748971193;"13926292";"16483510";"NO Top 10%";"NO 10% - 35%";"NO 35% - 60%";1;0
"Mathematical Modelling of Natural Phenomena";19900192596;0,446540880503145;"09735348";"17606101";"NO Top 10%";"NO 10% - 35%";1;0;"NO Bottom 20%"
"Mathematical Notes";96933;0,331061343719572;"00014346";"15738876";"NO Top 10%";"NO 10% - 35%";6;1;0
"Mathematical Proceedings of the Cambridge Philosophical Society";25325;0,765676567656766;"03050041";"14698064";13;1;0;"NO 60% - 80%";"NO Bottom 20%"
"Mathematical Reports";21100262314;0,143646408839779;"15823067";"22853898";"NO Top 10%";"NO 10% - 35%";"NO 35% - 60%";4;0
"Mathematical Research Letters";25055;0,852112676056338;"10732780";"1945001X";3;0;"NO 35% - 60%";"NO 60% - 80%";"NO Bottom 20%"
"Mathematical Structures in Computer Science";5000157801;0,461538461538462;"09601295";"14698072";"NO Top 10%";"NO 10% - 35%";1;0;"NO Bottom 20%"
"Mathematics Magazine";21100198508;0,05;"0025570X";"19300980";"NO Top 10%";"NO 10% - 35%";"NO 35% - 60%";"NO 60% - 80%";0
"Mathematics of Computation";25092;1,79545454545455;"00255718";"10886842";1;0;"NO 35% - 60%";"NO 60% - 80%";"NO Bottom 20%"
"Mathematika";25097;0,737089201877934;"00255793";"20417942";"NO Top 10%";1;0;"NO 60% - 80%";"NO Bottom 20%"
"Mathematische Annalen";25105;1,41608876560333;"00255831";"14321807";1;0;"NO 35% - 60%";"NO 60% - 80%";"NO Bottom 20%"
"Mathematische Nachrichten";25107;0,806324110671937;"0025584X";"15222616";5;1;0;"NO 60% - 80%";"NO Bottom 20%"
"Mathematische Semesterberichte";11200153516;0,0434782608695652;"0720728X";"14321815";"NO Top 10%";"NO 10% - 35%";"NO 35% - 60%";"NO 60% - 80%";0
"Mathematische Zeitschrift";25123;0,978185993111366;"00255874";"14328232";2;0;"NO 35% - 60%";"NO 60% - 80%";"NO Bottom 20%"
"Mediterranean Journal of Mathematics";145249;0,576288659793814;"16605446";"16605454";"NO Top 10%";3;0;"NO 60% - 80%";"NO Bottom 20%"
"Memoirs of the American Mathematical Society";24671;2,90963855421687;"00659266";"19476221";1;0;"NO 35% - 60%";"NO 60% - 80%";"NO Bottom 20%"
"Michigan Mathematical Journal";25148;0,787128712871287;"00262285";"19452365";5;1;0;"NO 60% - 80%";"NO Bottom 20%"
"Milan Journal of Mathematics";100147303;0,868421052631579;"14249286";"14249294";3;0;"NO 35% - 60%";"NO 60% - 80%";"NO Bottom 20%"
"Missouri Journal of Mathematical Sciences";25153;0,0394736842105263;"08996180";"10852581";"NO Top 10%";"NO 10% - 35%";"NO 35% - 60%";"NO 60% - 80%";0
"Monatshefte fur Mathematik";25167;0,714524207011686;"00269255";"14365081";"NO Top 10%";1;0;"NO 60% - 80%";"NO Bottom 20%"
"Moscow Mathematical Journal";19900192728;0,775280898876405;"16093321";"16094514";7;1;0;"NO 60% - 80%";"NO Bottom 20%"
"Nagoya Mathematical Journal";25200;0,557251908396947;"00277630";"21526842";"NO Top 10%";3;0;"NO 60% - 80%";"NO Bottom 20%"
"New York Journal of Mathematics";25221;0,663608562691132;"10769803";"10769803";"NO Top 10%";1;0;"NO 60% - 80%";"NO Bottom 20%"
"Note di Matematica";21100244002;0,231481481481481;"11232536";"15900932";"NO Top 10%";"NO 10% - 35%";"NO 35% - 60%";2;0
